Section,Parv,Key Event,Summary
1,Adi Parv,Maharaja Shantanu Marries the Celestial Ganga,"According to the historical records of this earth, there once lived a King named Maharaja Shantanu, the son of Pratipa, who took his birth in the solar dynasty and was considered naradeva, the manifest representative of the Supreme Lord on earth. His fame and rule extended to all parts of the world. The qualities of self-control, liberality, forgiveness, intelligence, modesty, patience and power always resided this exalted emperor. His neck was marked with three lines like a conchshell, and his shoulders were broad. In prowess He resembled a maddened elephant. Above all these qualities, he was a devoted servant of Lord Vishnu, and therefore he was given the title, ""King of kings"".
Once when Maharaja Shantanu, that bull among men, was wandering in the forest, he came upon a place frequented by the Siddhas and Charanas (a class of heavenly demigods). There he saw an angelic woman who appeared like the goddess of fortune herself. In truth, she was the personification of the river Ganges. She was glancing at the monarch with her youthful longing eyes, and Maharaja Shantanu became attracted to her. He then approached her inquiring, ""O beautiful woman, are you from the race of the Gandharvas, Apsaras, Yakshas, Nagas or the human race? As yet I have no queen, and your birth appears divine. Whatever your origin, O celestial beauty, I request you to become my wife.""
The beautiful apsara (celestial maiden) then smilingly replied, ""O King, I shall become your wife and obey your commands, but there are certain conditions. You should not interfere with my actions, whether agreeable or disagreeable. Also you should never chastise me with harsh words. If you assent to my request, I shall live with you.  The King, infatuated with love, agreed to her proposals.
Having taken the lovely Ganga for his wife, Maharaja Shantanu passed many years in her association. She satisfied the King by her charm and affection, as well as by her music and dance; and thus the King passed many seasons unconscious of time. While enjoying himself in her company, he conceived eight children by her that were equal in quality to the heavenly gods. However, on the birth of each child, Ganga threw them into the river, exclaiming, ""This is for your good!  The King was not pleased with his wife's conduct, but he dared not speak a chastising word, lest she leave his company. However, when the eighth child was born, the King could not tolerate the killing of another child and he spoke harshly, ""Do not kill this child! Why do you kill your own children? O murderess of your sons, the reaction to such sin is very great!
When reproached in these words, the celestial beauty replied, ""I shall not cast this child into the river, but according to our marriage agreement, our relationship has ended. I am Ganga, the personification of the River Ganges, and I am ever-worshipped by the great sages and common people. My origin is the divine feet of Lord Vishnu. I have lived with you only to accomplish the purpose of the demigods. The eight Vasus were cursed by Vashistha Muni, and thus they have appeared on earth as a reaction to that curse. They have pleaded wth me to free them from this bondage immediately after their birth. I have lived with you long enough to fulfill my promise to the Vasus. This last child is destined to live on earth for some time. His name will be Devavrata, and he shall be famous as a lion among men.
Maharaja Shantanu then inquired from his wife, ""What offense did the Vasu's commit for which they were born on earth as human beings? Why, also, is this last child destined to live on earth longer than the others? O Ganga, my wife, please clarify this.
 Being thus questioned by the King of the earth, Ganga replied to the Monarch, ""O best of the Bharata race, on Mount Meru there are many picturesque forests. In one such wooded region lives a renowned sage named Vashistha Muni. He is adept in the practice of austerity and meditation. With the help of his Kamadhenu cow, he performs sacrifices to please the Supreme Being. One , the eight Vasus headed by Prithu came to that forest. Roaming about with their wives, the Vasus entered the hermitage of Vashistha Muni. At that time they spotted the celestial cow named Nandini. One of the Vasus, whose name was Dyu, then informed his wife, This cow belongs to the eminent sage Vashistha, and it is said that the mortal who drinks the milk of this cow remains unchanged for ten thousand years.' Turning to her husband she replied, I have a very dear friend named Jitavati who is the daughter of the sage Usinara. I wish to take this cow and calf as a present for her.' When repeatedly petitioned by his beautiful wife, Dyu, along with his brothers, abducted the Kamadhenu cow, forgetting who was the actual owner.
That evening, when Vashistha returned to his hermitage, he could not find his Kamadhenu cow or its calf. He began to search the forest, but nowhere could they be found. By his mystic power, obtained by long years of austerity, he then understood that the cow and its calf had been taken away by the Vasus. When the sage's wrath was kindled, he cursed the Vasus, Because the Vasus have stolen my Kamadhenu cow, I curse them to be born on earth as ordinary mortals.' The sage then returned to his practice of ascetic meditation.
""When the Vasus heard of Vashistha's curse, they came to his hermitage to pacify him. They praised him with amiable words and offered to return the cow. However, they failed to obtain clemency from the great sage. The great brahmana Vashistha, who is naturally kind to everyone, then compassionately said, This curse is the suitable punishment to rectify your enjoying mentality. You will be freed from it shortly after your earthly birth. However, your brother Dyu, who actually stole my cow, shall have to domicile on earth for a long period of time. Dyu, though living on earth, shall not marry and have children. He will, however, be a man of kingly virtue and will know the essence of the holy scriptures. He will be an obedient servitor to his father, but will have to live without female companionship.'
""The Vasus  Ganga continued, ""then came to me and begged a benediction. They asked that I cast them into the waters of the Ganges immediately upon taking their birth. O best among kings, I have fulfilled their desire, but this last child, Dyu, will have to reside on earth for some time to fulfill the curse of Vashistha Muni.  Having related the Vasus' history, Ganga disappeared with the child, and the King returned to his palace with a sorrowful heart."
2,Adi Parv,Maharaja Shantanu and Devavrata,"Many, many years passed, and Maharaja Shantanu had to learn to live in separation from his wife and son. One  while chasing a deer along the bank of the Ganges, the King noticed that the river had become shallow. He had never seen this before, and he sought the cause. While searching along the river bank, he spotted a handsome, powerful, and heroic youth. The boy was releasing celestial weapons impeding the flow of the Ganges. This young boy was Maharaja Shantanu's son, whom he had not seen since the boy was born. However, the King could not recognize him as such because he had only seen his son for a few moments after his birth. The youth, upon seeing his father, knew him to be so and out of shyness disappeared from sight.
King Shantanu was struck with wonder and imagined that the youth might be his own son. He then continued down the river bank, and there he saw Ganga whom he had not seen in years. As he approached her, he saw the same boy standing at her side. She then informed the king, ""O best among kings, our eighth child is standing next to me. His name is Devavrata. He has been trained in the heavenly planets and has knowledge of all the celestial weapons of warfare. Devavrata has been the student of Vashistha Muni, who has taught our son the Vedas and their branches. O descendent of Bharata, both the demigods and the demons look upon him with favor. Whatever knowledge the sage Brihaspati has learned, this child has also learned, and whatever weapons the powerful and great Parashurama possess, this boy also possesses. Now that his training is complete, you may take Devavrata and raise him as your own.  Thus commanded by Ganga, Devavrata accompanied Maharaja Shantanu to his capital city.
 Maharaja Shantanu became attached to the boy who was endowed with all good qualities. Devavrata also became attached to his father, and it was seen that the two were always together. They talked together, walked together, ate together, slept together, and hunted together. Indeed, they were almost inseparable. Four years passed in this way.
One , the King entered the forest along the bank of the Yamuna. While roaming in that region, he perceived a sweet aroma coming from an unknown direction. He followed the scent, and while wandering here and there, he came across a woman of heavenly beauty. Her name was Satyavati, and she was the daughter of a fisherman. He was pierced by the arrows of Cupid, and desiring her for his wife, he inquired, ""Who are you, and who is your father? Also, please tell me what you are doing here.  Replying to the King she said, ""My name is Satyavati, and I am the daughter of the fishermen King. My father has engaged me in the pious activity of rowing passengers across the river Yamuna.
Bewildered by the beauty and charm of this girl, the King approached the fisherman and spoke to him of a proposed marriage. The fisherman replied, ""My daughter certainly could not find a more suitable husband than yourself. However, you must fulfill my one desire. I wish that the son born of my daughter be the next king of the world, and no one else can become your successor.
When that great descendant of Bharata heard the terms for gaining Satyavati, he felt no desire to grant such a benediction, and thus he returned to his capital. While riding on his chariot, he constantly thought of the beautiful fisherman's daughter. With a sorrowful heart, he entered his palace and did not say a word to anyone, not even Devavrata. Upon seeing his father's unhappiness, Devavrata approached him inquiring, ""Please tell me father why you are so unhappy? You have not spoken a word to me, nor have you performed your daily duties. Please reveal the cause of your distress, and I will find a cure for it.
When requested in these words, Maharaja Shantanu replied, ""My dear son, I am thinking of the instability of human life. If sudden death were to overcome you, I would be without a son. You are like a hundred sons to me, and I do not desire to marry again. I only desire that our dynasty be perpetuated. The wise say that he who has one son has no son at all. It is quite possible that you will be slain on the battle field, and if that happens, what will be the state of the Bharata dynasty? It is these thoughts that have made me so unhappy.
Devavrata was intelligent and reflected on his father's words. He felt there was something more than his father had revealed. He then went to the King's chariot driver and questioned him about the cause of the monarch's sullen mood. The charioteer told Devavrata about the fisherman's daughter and the benediction sought by her father. Understanding the situation, Devavrata, accompanied by some of the family elders, went to the fisherman's cottage. The chief of the fishermen greeted Devavrata, offering him a seat. He then informed him in sweet words, ""O son of Shantanu, I welcome you for you are the pride of the kshatriya race. You are certainly invincible, but I have something to tell you. Even if the future husband of my daughter were to be Indra himself, he would have to lament, for the requirements for marrying Satyavati apply to all. Many sages have told me that your father is the only suitable husband for Satyavati. I have even rejected the requests of the great rishis in the matter of her marriage. The one great obstacle to this marriage is that you will be crowned King and not the son born of Satyavati and Shantanu. This is all I have to say in the matter.
Understanding the fisherman's desire, Devavrata meditated on the situation, and wanting to benefit his father, he informed the fisherman, ""O fisherman, listen to my vow. There has not been, nor will there ever be born a man who can make this vow. I shall fulfill your request. I take the vow that the son born from Satyavati and my father shall be king, and I shall relinquish my claim to the throne.
Upon hearing Devavrata's promise, the fisherman, who sought sole sovereignty for Satyavati's son, said, ""This vow that you have taken will certainly come to pass, but I have one doubt that is still in my mind. What will happen to your children? They may also claim the throne.  Devavrata replied, ""O chief among fishermen, listen to the vow I shall make in the presence of these assembled elders. I have already relinquished my claim to the throne, and now I shall settle the matter of my descendants. I shall adopt the vow of brahmacharya and agree never to marry.
Hearing the oath spoken by Devavrata, the hair on the fisherman's body stood on end, and he promised, ""I shall hand over my daughter to Shantanu.  When Devavrata made this vow, the heavenly denizens showered flowers, and the firmament was filled with the sounds, ""This one shall be known as Bhishma [one who has taken a difficult vow].  The only sounds heard were ""Bhishma!, Bhishma!, This one shall be called Bhishma!
Ganga's son then took Satyavati on the chariot and returned to Hastinapura. When Maharaja Shantanu heard about the oath his son had taken, he was pleased and gave him a benediction, ""You shall never experience death as long as you wish to live. Indeed, you will die only when you desire it.  Thus Satyavati was married to Maharaja Shantanu, and that glorious King accepted her into his palace and maintained her as she desired."
3,Adi Parv,Bhishma Abducts Three Princesses,"In due course, Maharaja Shantanu's Queen, Satyavati, bore a highly qualified son named Chitrangada. He was blessed with invincible power and was destined to become a renowned archer. Later, another son was born to Satyavati, named Vichitravirya. He developed into a natural leader and heroic warrior. As the two sons grew to maturity, they brought joy to the King and Queen. Soon Maharaja Shantanu found himself growing old, and seeing the influence of inevitable time, he decided to retire to the forest to practice austerities for realizing the kingdom of God. Before entering the forest, Maharaja Shantanu enthroned Chitrangada as the world's king under Bhishma's protection. He then departed to the forest alone to perform penances and austerities. Maharaja Shantanu soon became absorbed in trance and realized his original relationship with the Lord in the kingdom of God. When his meditation upon the Lord's transcendental form was unbroken, he ascended to the spiritual world.
When Chitrangada became King, he soon challenged and eliminated all opponents on the planet earth. Indeed, all the earthly kings considered that there was no kshatriya equal to him. Nevertheless, in the heavenly planets there lived a Gandharva King whose name was also Chitrangada. Upon hearing that an earthly being bore his name and was considered invincible, he challenged the son of Satyavati. There then took place on the field of Kurukshetra a battle that endured for a full three years. Both Chitrangadas were powerful, and the battle was fierce, but in the end the Kuru prince was slain. The King of the Gandharvas then ascended to the heavenly planets satisfied at heart. After the death of his step brother, Bhishma performed the last funeral rites and then enthroned Vichitravirya as the world's emperor, although he was only a small boy. Until Vichitravirya matured in age, Bhishma ruled the kingdom. Maharaja Bhishma took care of Vichitravirya like a father, arranging for the education and military training of the future king.
When Maharaja Bhishma saw that Vichitravirya was of marriageable age, he thought of obtaining a queen for him. At this time he heard that in the kingdom of Kashi three daughters were being offered in marriage. These princesses had heavenly beauty, and it was known that they were to select their own husbands. Bhishma went alone in his chariot to the city of Varanasi, and there he saw countless monarches who had assembled hoping to wed one of the princesses. The names of those beautiful girls were Amba, Ambika and Ambalika. While the daughters of the King were being introduced to the assembled heroic princes, Bhishma stood up in the assembly and commanded, ""The wise have declared that when a qualified person has been invited to a svayamvara, a maiden may be bestowed upon him. There are eight kinds of marriage ceremonies, but the wise highly applaud that a princess taken by force in the presence of competitors is the foremost svayamvara. Therefore, strive to your best ability to defeat me or be defeated.
After challenging the assembled kings and princes, Bhishma put the three princesses on his chariot and proceeded to leave the Kashi kingdom. The kshatriya princes then stood up and, in great fury, challenged Bhishma to a fight. They put on their armour and pursued him in great haste. Attacking Ganga's son with full force, they poured a thick deluge of arrows upon him. Maharaja Bhishma, however, nullified those arrows with his own, and then pierced each prince with three shafts.The princes in turn pierced Bhishma with many arrows, and then released javelins and darts hoping to encompass his death. The battle was fought with such intense fury that even those who were courageous became struck with fear. Keeping his bow drawn in a constant circle, Bhishma severed arrows, bows, flagstaffs, coats of armor and human heads by the hundreds. The son of Ganga defeated the supporting armies that opposed him, and those who were heroes applauded the prowess of such a great warrior. When Shantanu's son had crushed all opponents, he proceeded to the Kuru kingdom, taking with him the three heavenly princesses.
While Maharaja Bhishma was proceeding toward Hastinapura, King Salwa, whose prowess was famed, suddenly appeared from behind. He challenged Bhishma, ""Wait!, Wait!  Bhishma flamed up in anger and turned to meet the challenge of the oncoming monarch. All the princes, who had been defeated, assembled to see the battle between those two bulls among men. King Salwa first covered Bhishma with many golden arrows. All the assembled princes applauded Salwa's prowess, but Bhishma was furious and told his charioteer, ""Take me closer to Salwa's chariot, so I may kill him in the way Garuda kills a serpent.  The Kuru chief then fixed the varuna weapon to his bow, and releasing it put Salwa's horses into confusion. This weapon caused a tidal wave to appear. Showing his supremacy with the bow, Bhishma released a flaming arrow which killed Salwa's charioteer. The powerful son of Shantanu then released the aindra weapon which killed Salwa's horses. (This weapon is similar to a modern  machine gun, but is more powerful and more accurate.) As the battle continued, Bhishma shattered all the weapons of Salwa, but left him with his life. After defeating all opponents, Bhishma proceeded to Hastinapura and offered the beautiful princesses to his younger brother.
After performing this uncommon exploit, Bhishma arranged the marriage ceremony for Vichitravirya. At that time the eldest daughter of the Kashi King, whose name was Amba, approached Bhishma appealing to him, ""At heart I had chosen King Salwa as my husband. He had in his heart chosen me for his wife. This was also approved by my father. At the svayamvara in Kashi I would have garlanded him and accepted him as my lord if you had not forcibly taken me away. You are aware of moral principles, so please decide whether I am free to go.  Bhishma deliberated for some time, and after consulting with qualified brahmanas, he decided that Amba could return to the kingdom of Kashi and marry the lord of her heart.
The other two princesses, Ambika and Ambalika, who were as beautiful as the heavenly denizens, accepted Vichitravirya as their husband and considered themselves very fortunate. They considered him a worthy husband, and loved and respected him in every way. Vichitravirya was endowed with the prowess of the devas and could steal away the heart of any woman. Thus King Vichitravirya was duly married to the princesses of Kashi, and he passed seven years happily in their company. However, while he was still in his youth, he was attacked by tuberculosis, and although everyone tried to effect a cure, the Kuru prince died, setting like the evening sun. Bhishma lamented the death of his younger brother, and finally performed the last funeral rites."
